reports/final_test/dentex_v4_region_extended_final_test_20260524_161241/compare_20260524_161245_1fdf7df/summary.csv

experiment,weights,imgsz,conf,iou,split,precision,recall,mAP50,mAP50-95,params,GFLOPs,model_size_MB,speed_preprocess,speed_inference,speed_postprocess
yolov8n_1280_full,/root/autodl-tmp/work/yolov8-train/runs/detect/dentex_v4_region_full/dentex_v4_region_yolov8n_1280_full_b16_20260523_143152_1cfc9f5/weights/best.pt,1280,0.001,0.7,test,0.634010355539951,0.6827989916605753,0.6488496269035636,0.3728848308458976,3006233,32.3493888,6.031717300415039,1.2950347326148812,1.3361232223434347,0.3931441298314185
yolov8n_c2f_faster_lite_1280_full,/root/autodl-tmp/work/yolov8-train/runs/detect/dentex_v4_region_c2f_faster_lite_full/dentex_v4_region_yolov8n_c2f_faster_lite_1280_full_b16_20260523_204914_87db6ce/weights/best.pt,1280,0.001,0.7,test,0.5884605486884179,0.6792990580328323,0.6482569100013552,0.37484427394965414,2602073,29.7639936,5.259622573852539,0.9983018866288806,1.0191420508481472,0.36811290957899057
yolov8m_1280_full,/root/autodl-tmp/work/yolov8-train/runs/detect/dentex_v4_region_yolov8m_full/dentex_v4_region_yolov8m_1280_full_b8_20260524_104521_1fdf7df/weights/best.pt,1280,0.001,0.7,test,0.6437450487821871,0.7174718532360681,0.6659519274055928,0.36917963934647235,25841497,314.7804672,49.693254470825195,1.0470199350202989,5.660041778762445,0.44176984175502537
yolov8m_c2f_faster_lite_1280_full,/root/autodl-tmp/work/yolov8-train/runs/detect/dentex_v4_region_yolov8m_c2f_faster_lite_full/dentex_v4_region_yolov8m_c2f_faster_lite_1280_full_b8_20260524_132149_1fdf7df/weights/best.pt,1280,0.001,0.7,test,0.6252518275739232,0.6922795377975978,0.6490815435911271,0.38040451121740676,20689897,275.030016,39.863847732543945,1.0846165047389007,5.342591708110712,0.4098363946849736

reports/final_test/dentex_v4_region_extended_final_test_report.md

## 5. Cost Comparison

- Params: 25.841M -> 20.690M, down 19.9%.
- GFLOPs: 314.780 -> 275.030, down 12.6%.
- Model size: 49.69 MB -> 39.86 MB, down 19.8%.
- Inference time: 5.66 ms/img -> 5.34 ms/img, down 5.6%.